id,title,release_date,release_year,release_month,popularity,vote_average,vote_count,genres,original_language,overview
37034,True Legend,2010-02-09,2010.0,2.0,5.384,6.6,241,"Action, Fantasy",zh,"Su Qi-Er, a wealthy man living during the Qing Dynasty who loses his fortune and reputation as a result of a conspiracy against him. After being forced out onto the streets, Su dedicates his life to martial arts and reemerges as a patriotic hero known as the ""King of Beggars."""
24418,Cirque du Freak: The Vampire's Assistant,2009-10-23,2009.0,10.0,5.3719,5.845,1160,"Adventure, Fantasy, Action, 53",en,"When Darren Shan is taken to a circus that's chock-full of sideshow oddities, he meets a vampire and receives a life-changing bite on the neck."
4442,The Brothers Grimm,2005-08-26,2005.0,8.0,5.368,5.848,2933,"Adventure, Fantasy, Action, Comedy, 53",en,"Folklore collectors and con artists, Jake and Will Grimm, travel from village to village pretending to protect townsfolk from enchanted creatures and performing exorcisms. However, they are put to the test when they encounter a real magical curse in a haunted forest with real magical beings, requiring genuine courage."
832502,The Monkey King,2023-07-30,2023.0,7.0,5.3651,6.5,335,"Animation, Fantasy, Adventure, Family, Comedy",en,"A stick-wielding monkey teams with a young girl on an epic quest for immortality, battling demons, dragons, gods — and his own ego — along the way."
354279,Charming,2018-03-26,2018.0,3.0,5.3625,6.4,275,"Animation, Adventure, Comedy, Family, Fantasy, 10402, 10749",en,"Three fairy tale princesses find themselves engaged to the same guy, Prince Charming."
10730,King Kong,1976-09-08,1976.0,9.0,5.3354,6.281,913,"Adventure, Fantasy, Horror",en,An oil company expedition disturbs the peace of a giant ape and brings him back to New York to exploit him.
1116465,A Legend,2024-07-05,2024.0,7.0,5.3335,6.796,152,"Action, Adventure, Fantasy",zh,An archeologist noticed that the texture of the relics discovered during the excavation of a glacier closely resembled a jade pendant seen in one of his dreams. He and his team then embark on an expedition into the depths of the glacier.
2323,Field of Dreams,1989-04-21,1989.0,4.0,5.3226,7.11,1652,"Drama, Fantasy",en,"Ray Kinsella is an Iowa farmer who hears a mysterious voice telling him to turn his cornfield into a baseball diamond. He does, but the voice's directions don't stop -- even after the spirits of deceased ballplayers turn up to play."
22586,The Swan Princess,1994-11-18,1994.0,11.0,5.3164,6.579,1011,"Family, Animation, Fantasy, Adventure, Comedy",en,"The beautiful princess Odette is transformed into a swan by an evil sorcerer's spell. Held captive at an enchanted lake, she befriends Jean-Bob the frog, Speed the turtle and Puffin the bird. Despite their struggle to keep the princess safe, these good-natured creatures can do nothing about the sorcerer's spell, which can only be broken by a vow of everlasting love."
420808,Peter Pan & Wendy,2023-04-20,2023.0,4.0,5.3092,5.429,759,"Family, Fantasy, Action, Adventure",en,"Wendy Darling, a young girl afraid to leave her childhood home behind, meets Peter Pan, a boy who refuses to grow up. Alongside her brothers and a tiny fairy, Tinker Bell, she travels with Peter to the magical world of Neverland. There, she encounters an evil pirate captain, Captain Hook, and embarks on a thrilling adventure that will change her life forever."
329996,Dumbo,2019-03-27,2019.0,3.0,5.3043,6.589,4510,"Family, Fantasy, Adventure",en,"A young elephant, whose oversized ears enable him to fly, helps save a struggling circus, but when the circus plans a new venture, Dumbo and his friends discover dark secrets beneath its shiny veneer."
9954,The Covenant,2006-09-07,2006.0,9.0,5.2992,5.59,1090,"Fantasy, Horror, Adventure, Action",en,Four young men who belong to a supernatural legacy are forced to battle a fifth power long thought to have died out. Another great force they must contend with is the jealousy and suspicion that threatens to tear them apart.
32985,Solomon Kane,2009-12-23,2009.0,12.0,5.2932,6.032,1512,"Adventure, Fantasy, Action",en,"A nomadic 16th century warrior, condemned to hell for his brutal past, seeks redemption by renouncing violence, but finds some things are worth burning for as he fights to free a young Puritan woman from the grip of evil."
730840,Trollhunters: Rise of the Titans,2021-07-21,2021.0,7.0,5.2908,7.525,355,"Animation, Fantasy, Family, Action, Adventure",en,"The Guardians of Arcadia reunite to battle the nefarious Arcane Order, who've reawakened the primordial Titans."
1263421,Baki Hanma VS Kengan Ashura,2024-06-05,2024.0,6.0,5.2827,7.433,323,"Animation, Action, Fantasy",ja,"It's the ultimate showdown. The toughest fighters from ""Baki Hanma"" and ""Kengan Ashura"" clash in this unprecedented, hard-hitting martial arts crossover."
1494,Curse of the Golden Flower,2006-12-14,2006.0,12.0,5.2717,6.86,811,"Action, Drama, Fantasy",zh,"During China's Tang dynasty the emperor has taken the princess of a neighboring province as his wife. She has borne him two sons and raised his eldest. Now his control over his dominion is complete, including the royal family itself."
230652,Pirates of the Caribbean: Tales of the Code: Wedlocked,2011-10-18,2011.0,10.0,5.2683,6.752,113,"Adventure, Action, Fantasy",en,"Wenches Scarlett and Giselle fix each other up for their wedding, in which they would each marry their groom. Upon realizing that both their grooms were the same man, Jack Sparrow, the two wenches found themselves in an auction led by the Auctioneer. This short film serves as a prequel to The Curse of the Black Pearl, and explains just why Jack Sparrow's boat the Jolly Mon was seen sinking at the beginning of the whole story; why the wenches were so upset with him; and how Cotton lost his tongue."
9678,Little Nicky,2000-11-10,2000.0,11.0,5.2574,5.842,1961,"Comedy, Fantasy",en,"After the lord of darkness decides he will not cede his throne to any of his three sons, the two most powerful of them escape to Earth to create a kingdom for themselves. This action closes the portal filtering sinful souls to Hell and causes Satan to wither away. He must send his most weak but beloved son, Little Nicky, to Earth to return his brothers to Hell."
409297,A Dark Song,2016-07-08,2016.0,7.0,5.2433,6.304,541,"Horror, Fantasy, 9648",en,A determined young woman and a damaged occultist risk their lives and souls to perform a dangerous ritual that will grant them what they want.
41513,The Smurfs,2011-07-29,2011.0,7.0,5.2374,5.758,3983,"Animation, Family, Adventure, Comedy, Fantasy",en,"When the evil wizard Gargamel chases the tiny blue Smurfs out of their village, they tumble from their magical world and into ours -- in fact, smack dab in the middle of Central Park. Just three apples high and stuck in the Big Apple, the Smurfs must find a way to get back to their village before Gargamel tracks them down."
170657,Journey to the West: Conquering the Demons,2013-02-07,2013.0,2.0,5.2336,6.912,433,"Action, Fantasy, Adventure, Comedy",zh,"In a world plagued by demons who cause great human suffering, young demon hunter Tang Sanzang must fight against monstrous demons, as well as contend with a beautiful demon hunting woman on his path to enlightenment."
1139829,Orion and the Dark,2024-02-01,2024.0,2.0,5.233,6.527,632,"Animation, Family, Comedy, Fantasy, Adventure",en,"A boy with an active imagination faces his fears on an unforgettable journey through the night with his new friend: a giant, smiling creature named Dark."
12159,What Dreams May Come,1998-10-02,1998.0,10.0,5.2314,7.198,2463,"Drama, Fantasy, 10749",en,"Chris Nielsen dies to find himself in a heaven more amazing than he could have ever dreamed of. There is one thing missing: his wife. After he dies, his wife Annie killed herself and went to hell. Chris decides to risk eternity in Hades for the small chance that he will be able to bring her back to heaven."
338958,Disenchanted,2022-11-18,2022.0,11.0,5.223,6.69,1171,"Comedy, Family, Fantasy",en,"Disillusioned with life in the city, feeling out of place in suburbia, and frustrated that her happily ever after hasn’t been so easy to find, Giselle turns to the magic of Andalasia for help. Accidentally transforming the entire town into a real-life fairy tale and placing her family’s future happiness in jeopardy, she must race against time to reverse the spell and determine what happily ever after truly means to her and her family."
653,Nosferatu,1922-02-16,1922.0,2.0,5.2142,7.654,2428,"Horror, Fantasy",de,"The mysterious Count Orlok summons a happily married real estate agent to his castle, located up in the Transylvanian mountains, to finalise a terrifying deal."
173,"20,000 Leagues Under the Sea",1954-12-23,1954.0,12.0,5.2104,7.1,974,"Adventure, Sci-Fi, Fantasy",en,"A ship sent to investigate a wave of mysterious sinkings encounters the advanced submarine, the Nautilus, commanded by Captain Nemo."
7278,Meet the Spartans,2008-01-24,2008.0,1.0,5.2086,4.1,1837,"Comedy, Fantasy",en,"The heroic Leonidas, armed with nothing but leather underwear and a cape, leads a ragtag group of thirteen Spartans to defend their homeland against the invading Persians (whose ranks include Ghost Rider, Rocky Balboa, the Transformers, and a hunchbacked Paris Hilton). No one is safe when the Spartans take on the biggest icons in pop culture!"
16523,Where the Wild Things Are,2009-10-16,2009.0,10.0,5.2081,6.497,2003,"Fantasy, Drama, Adventure, Family",en,"Max imagines running away from his mom and sailing to a far-off land where large talking beasts—Ira, Carol, Douglas, the Bull, Judith and Alexander—crown him as their king, play rumpus, build forts and discover secret hideaways."
3591,One Million Years B.C.,1966-11-24,1966.0,11.0,5.2059,6.123,240,"Adventure, Fantasy",en,"As the Earth wrestles with its agonizing birth, the peoples of this barren and desolate world struggle to survive. Driven by animal instinct they compete against the harsh conditions, their giant predators, and warring tribes. When two people from opposing clans fall in love, existing conventions are shattered forever as each tribe struggles for supremacy and Man embarks on his tortuous voyage of civilization."
14282,Ninja Scroll,1993-06-05,1993.0,6.0,5.2054,7.776,729,"Fantasy, Animation, Action",ja,"Jubei is a masterless ninja who travels the land alone, lending his services to those with gold—or a worthy cause. His fearsome abilities have served him well, but a plot to overthrow the government threatens to end his wandering ways—and possibly his life."
616747,Haunted Mansion,2023-07-26,2023.0,7.0,5.2032,6.429,1221,"Comedy, Drama, Fantasy",en,A woman and her son enlist a motley crew of so-called spiritual experts to help rid their home of supernatural squatters.
20982,Naruto Shippuden the Movie,2007-08-04,2007.0,8.0,5.2008,7.403,1054,"Animation, Action, Fantasy",ja,"Demons that once almost destroyed the world, are revived by someone. To prevent the world from being destroyed, the demon has to be sealed and the only one who can do it is the shrine maiden Shion from the country of demons, who has two powers; one is sealing demons and the other is predicting the deaths of humans. This time Naruto's mission is to guard Shion, but she predicts Naruto's death. The only way to escape it, is to get away from Shion, which would leave her unguarded, then the demon, whose only goal is to kill Shion will do so, thus meaning the end of the world. Naruto decides to challenge this ""prediction of death."""
266647,Pan,2015-09-24,2015.0,9.0,5.1939,5.955,2831,"Fantasy, Adventure, Family, Action",en,"Living a bleak existence at a London orphanage, 12-year-old Peter finds himself whisked away to the fantastical world of Neverland. Adventure awaits as he meets new friend James Hook and the warrior Tiger Lily. They must band together to save Neverland from the ruthless pirate Blackbeard. Along the way, the rebellious and mischievous boy discovers his true destiny, becoming the hero forever known as Peter Pan."
778855,Chickenhare and the Hamster of Darkness,2022-02-16,2022.0,2.0,5.1793,7.3,281,"Animation, Adventure, Comedy, Family, Fantasy",en,"Young Chickenhare is the adopted son of King Peter, a famous adventurer. Part chicken and part hare, he has a really tough time growing up and disguises himself as a hare to avoid the mockeries of his peers. When the day of the Royal Adventurer Society trials comes, Chickenhare, hampered by his disguise, fails miserably. But he is determined to grab a second chance and find the Scepter of the Hamster of Darkness, before his evil Uncle Lapin. The Scepter will give immense power to its holder. If Lapin gets hold of it, he will be unstoppable. Accompanied by his faithful servant Abe, a sarcastic turtle, and Meg, a martial arts expert skunk, he sets of on an epic and initiatory quest."
176983,One Piece Film: Z,2012-12-15,2012.0,12.0,5.1761,7.493,556,"Animation, Fantasy, Action, Adventure",ja,"Zephyr, now known as Z, rides the seas with only one goal: Destroy all pirates and their dreams at becoming King of Pirates. When Luffy and his crew encounter him at sea, not only are they utterly defeated by the man with an arm made of Seastone, Nami, Robin, and Chopper are turned 10 years younger due to Z's minion Ain. Luffy is so determined to win against him that he does not even notice Z's master plan that could sacrifice thousands of lives."
400106,Bright,2017-12-22,2017.0,12.0,5.1755,6.162,5942,"Fantasy, Action, 53",en,"In an alternate present-day where magical creatures live among us, two L.A. cops become embroiled in a prophesied turf battle."
642885,Hocus Pocus 2,2022-09-27,2022.0,9.0,5.1702,7.154,1811,"Fantasy, Comedy",en,"29 years since the Black Flame Candle was last lit, the 17th-century Sanderson sisters are resurrected, and they are looking for revenge. Now it's up to three high school students to stop the ravenous witches from wreaking a new kind of havoc on Salem before dawn on All Hallow's Eve."
431580,Abominable,2019-09-19,2019.0,9.0,5.1598,7.5,2163,"Family, Animation, Adventure, Comedy, Fantasy",en,"A group of misfits encounter a young Yeti named Everest, and they set off to reunite the magical creature with his family on the mountain of his namesake."
820232,Demon Slayer: Kimetsu no Yaiba - Sibling's Bond,2019-03-29,2019.0,3.0,5.1584,7.9,245,"Animation, Action, Fantasy, 53",ja,"Tanjiro Kamado returns home to find his family slaughtered and the lone survivor, his sister Nezuko, turned into a Demon. To his surprise, however, Nezuko still shows signs of human emotion and thought. Thus begins Tanjiro's journey to seek out the Demon who killed their family and turn his sister human again. A recap of Kimetsu no Yaiba episodes 1–5, with new footage and special end credits."
573730,Made in Abyss: Dawn of the Deep Soul,2020-01-17,2020.0,1.0,5.1555,7.8,285,"Animation, Adventure, Fantasy, 9648",ja,"A continuation of the epic adventure of plucky Riko and Reg who are joined by their new friend Nanachi. Together they descend into the Abyss' treacherous fifth layer, the Sea of Corpses, and encounter the mysterious Bondrewd, a legendary White Whistle whose shadow looms over Nanachi's troubled past. Bondrewd is ingratiatingly hospitable, but the brave adventurers know things are not always as they seem in the enigmatic Abyss."
106164,Doraemon: Nobita and the Galaxy Super-express,1996-03-02,1996.0,3.0,5.1486,7.5,54,"Animation, Sci-Fi, Action, Family, Adventure, Fantasy",ja,Doraemon went missing for 3 days. But it turns out later that he went to the 22nd century to buy a mystery galactic express train ticket whose destination is a secret until the passengers arrive there and see for themselves.
137227,Doraemon: Nobita and the New Steel Troops: Winged Angels,2011-03-05,2011.0,3.0,5.1447,7.349,83,"Animation, Adventure, Family, Sci-Fi, Fantasy, Comedy",ja,Nobita and Doraemon find a giant robot in pieces which they later assemble. It turns out to be a destructive weapon and the gang must save Earth from an imminent invasion.
515195,Yesterday,2019-06-26,2019.0,6.0,5.1335,6.683,4238,"Comedy, Fantasy, 10402, 10749",en,A struggling musician realizes he's the only person on Earth who can remember The Beatles after waking up in an alternate reality where the group was forgotten.
1319969,Sketch,2025-08-06,2025.0,8.0,5.1333,7.1,105,"Adventure, Fantasy, Comedy, Family",en,"When a young girl’s sketchbook falls into a strange pond, her drawings come to life—chaotic, real, and on the loose. As the town descends into chaos, her family must reunite and stop the monsters they never meant to unleash."
162072,Doraemon: Nobita Drifts in the Universe,1999-03-06,1999.0,3.0,5.1322,6.6,15,"Animation, Adventure, Family, Sci-Fi, Comedy, Fantasy",ja,"Nobita and his friends embark on a rescue mission to save Gian and Suneo, whom, after playing one of Doraemon's futuristic video games, are held captive by an evil alien force."
430162,Revolting Rhymes,2017-10-11,2017.0,10.0,5.1312,6.7,58,"Family, Animation, Comedy, Fantasy",en,Two half-hour animated films based on the much-loved rhymes written by Roald Dahl and illustrated by Quentin Blake.
55301,Alvin and the Chipmunks: Chipwrecked,2011-12-14,2011.0,12.0,5.1281,5.7,2339,"Comedy, Fantasy, Family, 10402, Animation",en,"Playing around while aboard a cruise ship, the Chipmunks and Chipettes accidentally go overboard and end up marooned in a tropical paradise. They discover their new turf is not as deserted as it seems."
841755,Mortal Kombat Legends: Battle of the Realms,2021-08-30,2021.0,8.0,5.1167,7.585,482,"Animation, Action, Fantasy",en,"The Earthrealm heroes must journey to the Outworld and fight for the survival of their homeland, invaded by the forces of evil warlord Shao Kahn, in the tournament to end all tournaments: the final Mortal Kombat."
436931,Pokémon the Movie: I Choose You!,2017-07-15,2017.0,7.0,5.1137,7.1,667,"Family, Animation, Adventure, Fantasy",ja,"Ash Ketchum wakes up late one morning after having broken his alarm clock in his sleep. He eventually makes it to Professor Oak's lab, but is told that the three starter List of Pokémon (Bulbasaur, Squirtle, and Charmander) have already been taken by Trainers who were on time. However, Oak reveals that he has one more Pokémon, an Electric-type named Pikachu. Despite its volatile and feisty personality, as well as its refusal to get inside a Poké Ball, Ash happily takes Pikachu for his journey."
5680,Elvira: Mistress of the Dark,1988-09-30,1988.0,9.0,5.1076,6.7,603,"Comedy, Fantasy, Horror",en,"Arriving in the small town of Fallwell, Massachusetts to claim her inheritance, horror hostess Elvira receives a less than enthusiastic reception from the conservative locals, including her sinister uncle Vincent."
585245,Clifford the Big Red Dog,2021-11-10,2021.0,11.0,5.105,7.152,1807,"Family, Adventure, Comedy, Fantasy",en,"As Emily struggles to fit in at home and at school, she discovers a small red puppy who is destined to become her best friend. When Clifford magically undergoes one heck of a growth spurt, becomes a gigantic dog and attracts the attention of a genetics company, Emily and her Uncle Casey have to fight the forces of greed as they go on the run across New York City. Along the way, Clifford affects the lives of everyone around him and teaches Emily and her uncle the true meaning of acceptance and unconditional love."
8698,The League of Extraordinary Gentlemen,2003-07-11,2003.0,7.0,5.1026,5.975,4314,"Fantasy, Action, 53, Sci-Fi",en,"To prevent a world war from breaking out, famous characters from Victorian literature band together to do battle against a cunning villain."
197796,Beauty and the Beast,2014-02-12,2014.0,2.0,5.1005,6.223,2154,"Fantasy, 10749",fr,"Forced to face the cruel side of life, a devastated, bankrupt merchant chances upon the enchanted castle of a hideous creature, the mere sight of it chills the bone to the marrow. There, a fate worse than death awaits the poor father-of-six, who, after plucking a sweet-scented rose from the repulsive master's verdant garden, must do the impossible: permit his compassionate daughter, Belle, to take his place and pay for the sins of her parent. Now, an impenetrable mystery shrouds the haunted mansion, and, as repugnance gradually turns into affection, only true love could break the spell."
826510,Harold and the Purple Crayon,2024-07-31,2024.0,7.0,5.1002,6.64,354,"Family, Comedy, Adventure, Fantasy",en,"Inside of his book, adventurous Harold can make anything come to life simply by drawing it. After he grows up and draws himself off the book's pages and into the physical world, Harold finds he has a lot to learn about real life."
9007,Just Like Heaven,2005-09-16,2005.0,9.0,5.0985,6.96,2550,"Comedy, 10749, Fantasy",en,"Shortly after David Abbott moves into his new San Francisco digs, he has an unwelcome visitor on his hands: winsome Elizabeth Masterson, who asserts that the apartment is hers -- and promptly vanishes. When she starts appearing and disappearing at will, David thinks she's a ghost, while Elizabeth is convinced she's alive."
663558,New Gods: Nezha Reborn,2021-02-06,2021.0,2.0,5.0769,8.058,509,"Animation, Fantasy, Action",zh,"While living as an ordinary deliveryman and motor racing fan, Nezha encounters old nemeses and must rediscover his powers to protect his loved ones."
10025,Just My Luck,2006-05-12,2006.0,5.0,5.0703,6.171,2001,"Comedy, Drama, Family, Fantasy, 10749",en,"Manhattanite Ashley is known to many as the luckiest woman around. After a chance encounter with a down-and-out young man, however, she realizes that she's swapped her fortune for his."
1034062,Mortal Kombat Legends: Cage Match,2023-10-17,2023.0,10.0,5.067,6.755,143,"Animation, Action, Fantasy, Adventure",en,"In 1980s Hollywood, action star Johnny Cage is looking to become an A-list actor. But when his costar, Jennifer, goes missing from set, Johnny finds himself thrust into a world filled with shadows, danger, and deceit. As he embarks on a bloody journey, Johnny quickly discovers the City of Angels has more than a few devils in its midst."
606234,Archive,2020-08-13,2020.0,8.0,5.0606,6.329,785,"Sci-Fi, Drama, Fantasy, 53",en,"2038: George Almore is working on a true human-equivalent AI, and his latest prototype is almost ready. This sensitive phase is also the riskiest as he has a goal that must be hidden at all costs—being reunited with his dead wife."
375588,Robin Hood,2018-11-03,2018.0,11.0,5.0568,5.909,3126,"Adventure, Action, 53, Fantasy",en,A war-hardened Crusader and his Moorish commander mount an audacious revolt against the corrupt English crown.
15301,Twilight Zone: The Movie,1983-06-24,1983.0,6.0,5.0503,6.48,797,"Horror, Fantasy, Sci-Fi",en,"An anthology film presenting remakes of three episodes from the ""Twilight Zone"" TV series—""Kick the Can"", ""It's a Good Life"" and ""Nightmare at 20,000 Feet""—and one original story, ""Time Out."""
23202,Trick 'r Treat,2007-12-09,2007.0,12.0,5.0432,6.986,2048,"Horror, Fantasy",en,"Four interwoven stories that occur on Halloween: an everyday high school principal has a secret life as a serial killer; a college virgin might have just met the one guy for her; a group of teenagers pull a mean prank, and a bitter old recluse receives an uninvited guest."
739990,Nightbooks,2021-09-15,2021.0,9.0,5.0425,6.088,413,"Fantasy, Horror, Family",en,"Alex, a boy obsessed with scary stories, is trapped by a witch in her modern, magical New York City apartment. His original hair-raising tales are the only thing keeping him safe as he desperately tries to find a way out of this twisted place."
593910,Cinderella,2021-09-03,2021.0,9.0,5.0423,6.3,1464,"Fantasy, 10749, Comedy",en,"Cinderella, an orphaned girl with an evil stepmother, has big dreams and with the help of her Fabulous Godmother, she perseveres to make them come true."
11824,Teen Wolf,1985-08-23,1985.0,8.0,5.0262,6.206,1251,"Comedy, Fantasy, 10749",en,When a shy teenager's new-found powers help him score at basketball - and with the popular girls - he has some pretty hairy decisions to make.
192904,Doraemon: Nobita in the Wan-Nyan Spacetime Odyssey,2004-03-06,2004.0,3.0,5.024,7.267,30,"Animation, Adventure, Family, Sci-Fi, Fantasy",ja,"Nobita, believing he and Doraemon had done a good deed by saving stray cats and dogs and sending them back in time by 300 million years, discover that the usage of Doraemon's Ray of Evolution had created a cat-and-dog-person society equal to Nobita's time. When an asteroid attack is set to hit the city, Nobita and his friends must save Doraemon and ease tensions between the two sides."
592350,My Hero Academia: Heroes Rising,2019-12-20,2019.0,12.0,5.0197,8.131,1264,"Animation, Action, Fantasy, Adventure",ja,"Class 1-A visits Nabu Island where they finally get to do some real hero work. The place is so peaceful that it's more like a vacation... until they're attacked by a villain with an unfathomable Quirk! His power is eerily familiar, and it looks like Shigaraki had a hand in the plan. But with All Might retired and citizens' lives on the line, there's no time for questions. Deku and his friends are the next generation of heroes, and they're the island's only hope."
314,Catwoman,2004-07-22,2004.0,7.0,4.9953,4.616,3556,"Action, Fantasy, 80",en,"Liquidated after discovering a corporate conspiracy, mild-mannered graphic artist Patience Phillips washes up on an island, where she's resurrected and endowed with the prowess of a cat — and she's eager to use her new skills... as a vigilante. Before you can say ""cat and mouse"", handsome gumshoe Tom Lone is on her tail, fascinated by both of her personas."
