id,title,release_date,release_year,release_month,popularity,vote_average,vote_count,genres,original_language,overview
137,Groundhog Day,1993-02-11,1993.0,2.0,7.7729,7.627,8820,"10749, Fantasy, Comedy",en,"A cynical TV weatherman, along with his idealistic producer and his sardonic cameraman, is sent to report on Groundhog Day in the small town of Punxsutawney, where he finds himself repeating the same day over and over."
2280,Big,1988-06-03,1988.0,6.0,7.7477,7.2,4005,"Fantasy, Drama, Comedy",en,When a young boy makes a wish at a carnival machine to be big—he wakes up the following morning to find that it has been granted and his body has grown older overnight. But he is still the same 13-year-old boy inside. Now he must learn how to cope with the unfamiliar world of grown-ups including getting a job and having his first romantic encounter with a woman.
10196,The Last Airbender,2010-06-30,2010.0,6.0,7.7468,4.645,4236,"Action, Adventure, Fantasy",en,"A century has passed since the Fire Nation declared war on the other three nations of air, water, and earth in its attempt for global domination. Aang, the long-lost Avatar, is found by Water Tribe siblings Katara and Sokka and must learn to master water, earth, and fire bending to defeat the Fire Nation and restore balance to the world."
18823,Clash of the Titans,2010-03-26,2010.0,3.0,7.7429,5.915,6640,"Adventure, Fantasy, Action",en,"Born of a god but raised as a man, Perseus is helpless to save his family from Hades, vengeful god of the underworld. With nothing to lose, Perseus volunteers to lead a dangerous mission to defeat Hades before he can seize power from Zeus and unleash hell on earth. Battling unholy demons and fearsome beasts, Perseus and his warriors will only survive if Perseus accepts his power as a god, defies fate and creates his own destiny."
766,Army of Darkness,1992-10-31,1992.0,10.0,7.7284,7.264,3486,"Fantasy, Horror, Comedy",en,"Ash, a handsome, shotgun-toting, chainsaw-armed department store clerk, is time warped backwards into England's Dark Ages, where he romances a beauty and faces legions of the undead."
9444,Anastasia,1997-11-20,1997.0,11.0,7.7068,7.6,5587,"Animation, Family, Fantasy, Adventure",en,"Ten years after she was separated from her family, an eighteen-year-old orphan with vague memories of the past sets out to Paris in hopes of reuniting with her grandmother. She is accompanied by two con men, who intend to pass her off as the Grand Duchess Anastasia to the Dowager Empress for a reward."
842924,The Life of Chuck,2025-06-05,2025.0,6.0,7.685,7.287,1009,"Fantasy, Drama",en,"In this extraordinary story of an ordinary man, Charles 'Chuck' Krantz experiences the wonder of love, the heartbreak of loss, and the multitudes contained in all of us."
8839,Casper,1995-05-26,1995.0,5.0,7.6845,6.336,4893,"Fantasy, Comedy, Family",en,"Casper is a kind young ghost who peacefully haunts a mansion in Maine. When specialist James Harvey arrives to communicate with Casper and his fellow spirits, he brings along his teenage daughter, Kat. Casper quickly falls in love with Kat, but their budding relationship is complicated not only by his transparent state, but also by his troublemaking apparition uncles and their mischievous antics."
353486,Jumanji: Welcome to the Jungle,2017-12-09,2017.0,12.0,7.6744,6.817,14397,"Adventure, Comedy, Fantasy, Action",en,"Four teenagers in detention discover an old video game console with a game they’ve never heard of. When they decide to play, they are immediately sucked into the jungle world of Jumanji in the bodies of their avatars. They’ll have to complete the adventure of their lives filled with fun, thrills and danger or be stuck in the game forever!"
812225,Black Clover: Sword of the Wizard King,2023-06-16,2023.0,6.0,7.6412,8.105,366,"Animation, Fantasy, Action, Adventure",ja,"As a lionhearted boy who can't wield magic strives for the title of Wizard King, four banished Wizard Kings of yore return to crush the Clover Kingdom."
338970,Tomb Raider,2018-03-05,2018.0,3.0,7.5867,6.365,8305,"Action, Adventure, Fantasy",en,"Lara Croft, the fiercely independent daughter of a missing adventurer, must push herself beyond her limits when she finds herself on the island where her father disappeared."
1550797,Prep & Landing: The Snowball Protocol,2025-11-27,2025.0,11.0,7.5577,7.2,27,"Animation, Comedy, Fantasy, Family",en,"Christmas elves Lanny and Wayne panic when their holiday missions go awry, leaving Wayne thinking he's in BIG trouble with Santa and accidentally revealing other merry mishaps."
35019,Nanny McPhee and the Big Bang,2010-03-26,2010.0,3.0,7.5529,6.313,1937,"Comedy, Fantasy, Family",en,"Nanny McPhee appears at the door of a harried young mother who is trying to run the family farm while her husband is away at war. But once she’s arrived, Nanny discovers that the children are fighting a war of their own against two spoiled city cousins who have just moved in. Relying on everything from a flying motorcycle and a statue that comes to life to a tree-climbing piglet and a baby elephant, Nanny uses her magic to teach her mischievous charges five new lessons."
793387,Holy Night: Demon Hunters,2025-04-30,2025.0,4.0,7.5319,6.84,97,"Action, Fantasy, Horror, 53",ko,"When a devil-worshipping criminal network plunges Seoul into chaos, the police turn to Holy Night—a trio of supernatural demon hunters—to restore order and defeat the rising evil."
765,Evil Dead II,1987-03-13,1987.0,3.0,7.5305,7.545,3445,"Horror, Comedy, Fantasy",en,"Ash Williams and his girlfriend Linda find a log cabin in the woods with a voice recording from an archeologist who had recorded himself reciting ancient chants from ""The Book of the Dead."" As they play the recording an evil power is unleashed taking over Linda's body."
116745,The Secret Life of Walter Mitty,2013-12-18,2013.0,12.0,7.5298,7.218,8187,"Adventure, Comedy, Drama, Fantasy",en,A timid magazine photo manager who lives life vicariously through daydreams embarks on a true-life adventure when a negative goes missing.
277,Underworld,2003-09-19,2003.0,9.0,7.5255,6.8,6549,"Fantasy, Action, 53",en,"Vampires and werewolves have waged a nocturnal war against each other for centuries. But all bets are off when a female vampire warrior named Selene, who's famous for her strength and werewolf-hunting prowess, becomes smitten with a peace-loving male werewolf, Michael, who wants to end the war."
9495,The Crow,1994-05-11,1994.0,5.0,7.5164,7.515,4481,"Fantasy, Action, 53",en,"Exactly one year after young rock guitarist Eric Draven and his fiancée are brutally killed by a ruthless gang of criminals, Draven, watched over by a hypnotic crow, returns from the grave to exact revenge."
462677,Doraemon: Nobita's Great Adventure in the Antarctic Kachi Kochi,2017-03-04,2017.0,3.0,7.5063,6.5,103,"Animation, Adventure, Fantasy, Family, Sci-Fi, Comedy",ja,"Doraemon and Nobita discover a mysterious golden ring far beneath the ice in Antarctica, leading them to uncover an ancient, ruined city."
555604,Guillermo del Toro's Pinocchio,2022-11-09,2022.0,11.0,7.4926,8.019,3299,"Animation, Fantasy, Adventure, Drama",en,"During the rise of fascism in Mussolini's Italy, a wooden boy brought magically to life struggles to live up to his father's expectations."
10515,Castle in the Sky,1986-08-02,1986.0,8.0,7.4889,8.0,4651,"Adventure, Fantasy, Animation, Action, Family",ja,A young boy and a girl with a magic crystal must race against pirates and foreign agents in a search for a legendary floating castle.
228161,Home,2015-03-18,2015.0,3.0,7.4859,6.8,4194,"Fantasy, Comedy, Animation, Sci-Fi, Family",en,"When Earth is taken over by the overly-confident Boov, an alien race in search of a new place to call home, all humans are promptly relocated, while all Boov get busy reorganizing the planet. But when one resourceful girl, Tip, manages to avoid capture, she finds herself the accidental accomplice of a banished Boov named Oh. The two fugitives realize there’s a lot more at stake than intergalactic relations as they embark on the road trip of a lifetime."
34584,The NeverEnding Story,1984-04-06,1984.0,4.0,7.4711,7.216,4344,"Adventure, Fantasy, Family, Drama",de,"While hiding from bullies in his school's attic, a young boy discovers the extraordinary land of Fantasia, through a magical book called The Neverending Story. The book tells the tale of Atreyu, a young warrior who, with the help of a luck dragon named Falkor, must save Fantasia from the destruction of The Nothing."
664767,Mortal Kombat Legends: Scorpion's Revenge,2020-04-12,2020.0,4.0,7.4671,8.088,1446,"Animation, Action, Fantasy",en,"After the vicious slaughter of his family by stone-cold mercenary Sub-Zero, Hanzo Hasashi is exiled to the torturous Netherrealm. There, in exchange for his servitude to the sinister Quan Chi, he’s given a chance to avenge his family – and is resurrected as Scorpion, a lost soul bent on revenge. Back on Earthrealm, Lord Raiden gathers a team of elite warriors – Shaolin monk Liu Kang, Special Forces officer Sonya Blade and action star Johnny Cage – an unlikely band of heroes with one chance to save humanity. To do this, they must defeat Shang Tsung’s horde of Outworld gladiators and reign over the Mortal Kombat tournament."
2758,Addams Family Values,1993-11-19,1993.0,11.0,7.4581,6.97,3285,"Comedy, Family, Fantasy",en,"Siblings Wednesday and Pugsley Addams will stop at nothing to get rid of Pubert, the new baby boy adored by parents Gomez and Morticia. Things go from bad to worse when the new ""black widow"" nanny, Debbie Jellinsky, launches her plan to add Fester to her collection of dead husbands."
268896,Pacific Rim: Uprising,2018-03-21,2018.0,3.0,7.4531,6.119,5292,"Action, Fantasy, Sci-Fi, Adventure",en,"It has been ten years since The Battle of the Breach and the oceans are still, but restless. Vindicated by the victory at the Breach, the Jaeger program has evolved into the most powerful global defense force in human history. The PPDC now calls upon the best and brightest to rise up and become the next generation of heroes when the Kaiju threat returns."
7980,The Lovely Bones,2009-12-26,2009.0,12.0,7.4526,7.06,4906,"Fantasy, Drama",en,"After being brutally murdered, 14-year-old Susie Salmon watches from heaven over her grief-stricken family -- and her killer. As she observes their daily lives, she must balance her thirst for revenge with her desire for her family to heal."
27022,The Sorcerer's Apprentice,2010-07-13,2010.0,7.0,7.4498,6.137,5238,"Fantasy, Adventure, Action",en,"Balthazar Blake is a master sorcerer in modern-day Manhattan trying to defend the city from his arch-nemesis, Maxim Horvath. Balthazar can't do it alone, so he recruits Dave Stutler, a seemingly average guy who demonstrates hidden potential, as his reluctant protégé. The sorcerer gives his unwilling accomplice a crash course in the art and science of magic, and together, these unlikely partners work to stop the forces of darkness."
1241921,A Big Bold Beautiful Journey,2025-09-17,2025.0,9.0,7.4207,6.223,364,"10749, Fantasy, Drama",en,"Sarah and David are single strangers who meet at a mutual friend’s wedding and soon, through a surprising twist of fate, find themselves on a funny, fantastical, sweeping adventure together where they get to re-live important moments from their respective pasts, illuminating how they got to where they are in the present... and possibly getting a chance to alter their futures."
433,Mary Poppins,1964-12-17,1964.0,12.0,7.4108,7.542,4975,"Comedy, Family, Fantasy",en,"In turn of the century London, a magical nanny employs music and adventure to help two neglected children become closer to their father."
13597,Labyrinth,1986-06-27,1986.0,6.0,7.4021,7.275,2709,"Adventure, Family, Fantasy",en,"Frustrated with babysitting on yet another weekend night, Sarah, a teenager with an active imagination, summons the Goblins to take her baby stepbrother away. When little Toby actually disappears, Sarah must follow him into a fantastical world to rescue him from the Goblin King. Guarding his castle is the labyrinth itself, a twisted maze of deception, populated with outrageous characters and unknown dangers."
2454,The Chronicles of Narnia: Prince Caspian,2008-05-15,2008.0,5.0,7.375,6.629,6726,"Adventure, Family, Fantasy",en,"One year after their incredible adventures in the Lion, the Witch and the Wardrobe, Peter, Edmund, Lucy and Susan Pevensie return to Narnia to aid a young prince whose life has been threatened by the evil King Miraz. Now, with the help of a colorful cast of new characters, including Trufflehunter the badger and Nikabrik the dwarf, the Pevensie clan embarks on an incredible quest to ensure that Narnia is returned to its rightful heir."
441130,Wolfwalkers,2020-10-26,2020.0,10.0,7.3441,8.195,1359,"Animation, Family, Adventure, Fantasy",en,"In a time of superstition and magic, when wolves are seen as demonic and nature an evil to be tamed, a young apprentice hunter comes to Ireland with her father to wipe out the last pack. But when she saves a wild native girl, their friendship leads her to discover the world of the Wolfwalkers and transform her into the very thing her father is tasked to destroy."
2268,The Golden Compass,2007-12-04,2007.0,12.0,7.2972,6.083,4802,"Adventure, Fantasy",en,"In a parallel universe, after overhearing a shocking secret, precocious orphan Lyra Belacqua trades her carefree existence roaming the halls of Jordan College for an otherworldly adventure in the far North, unaware that it's part of her destiny."
1153714,Death of a Unicorn,2025-03-27,2025.0,3.0,7.2942,6.408,790,"Horror, Fantasy, Comedy",en,"A father and daughter accidentally hit and kill a unicorn while en route to a weekend retreat, where his billionaire boss seeks to exploit the creature’s miraculous curative properties."
9374,Death Becomes Her,1992-07-30,1992.0,7.0,7.2917,6.776,2942,"Comedy, Fantasy, Horror",en,"Madeline is married to Ernest, who was once her arch-rival Helen's fiancé. After recovering from a mental breakdown, Helen vows to kill Madeline and steal back Ernest. Unfortunately for everyone, the introduction of a magic potion causes things to be a great deal more complicated than a mere murder plot."
70841,Doraemon: Nobita's Dinosaur,2006-03-04,2006.0,3.0,7.2889,7.473,92,"Animation, Adventure, Family, Fantasy, Sci-Fi",ja,"After bringing a fossilized egg back to life with the Time Cloth, Nobita finds himself the owner of a baby dinosaur. Everything is fine until it grows up. Nobita and friends use Doraemon's time machine to return it back to its own time."
346672,Underworld: Blood Wars,2016-11-24,2016.0,11.0,7.2863,5.913,3914,"Fantasy, Action, 53, Sci-Fi, Horror",en,"Vampire death dealer Selene fends off brutal attacks from both the Lycan clan and the Vampire faction that betrayed her. With her only allies, David and his father Thomas, she must stop the eternal war between Lycans and Vampires, even if it means she has to make the ultimate sacrifice."
1359607,Miss Kobayashi's Dragon Maid: A lonely dragon wants to be loved,2025-06-27,2025.0,6.0,7.2846,8.1,30,"Animation, Comedy, Fantasy",ja,"Miss Kobayashi, Tohru, Kanna, and Iruru's peaceful lives are shattered when Kanna's father, Kimun Kamui, leader of the Chaos Forces, arrives and forces her to return to the Dragon World to fix a past mistake. With a war brewing between Chaos and Harmony, Kanna must find a way to unite the two worlds but is torn between her loyalty to her friends and her father's demands. Miss Kobayashi, however, refuses to let her go and tries to mend Kanna and Kamui's broken bond. As dragons clash, Iruru uncovers a hidden force manipulating the war. Can they stop the war before it consumes both worlds?"
1139087,Once Upon a Studio,2023-09-24,2023.0,9.0,7.2798,8.273,423,"Animation, Family, Fantasy, Drama, Comedy",en,"Created for Disney's 100th anniversary, the short features Mickey Mouse corralling a gallery of legendary Disney characters for a group photo."
1014505,OVERLORD: The Sacred Kingdom,2024-09-20,2024.0,9.0,7.2677,7.865,170,"Action, Adventure, Animation, Fantasy",ja,"After twelve years of playing his favorite MMORPG game, Momonga logs in for the last time only to find himself transported into its world playing it indefinitely. Throughout his adventures, his avatar ascends to the title of Sorcerer King Ains Ooal Gown. Once prosperous but now on the brink of ruin, The Sacred Kingdom enjoyed years of peace after construction of an enormous wall protecting them from neighboring invasions. But, one day this comes to an end when the Demon Emperor Jaldabaoth arrives with an army of villainous demi-humans. Fearing invasion of their own lands, the neighboring territory of the Slane Theocracy is forced to beg their enemies at the Sorcerer Kingdom for help. Heeding the call, Momonga, now known as the Sorcerer King Ains Ooal Gown, rallies the Sorcerer Kingdom and its undead army to join the fight alongside the Sacred Kingdom and the Slane Theocracy in hopes to defeat the Demon Emperor."
228165,The SpongeBob Movie: Sponge Out of Water,2015-01-28,2015.0,1.0,7.2447,6.098,2515,"Family, Animation, Adventure, Fantasy, Comedy",en,"Evil pirate Burger Beard is in search of the final page of a magical book that makes any evil plan he writes in it come true, but the final page happens to be the Krabby Patty secret formula. When Burger Beard endangers Bikini Bottom, SpongeBob, Patrick, Mr. Krabs, Squidward, Sandy, and Plankton must embark on a quest to retrieve the recipe and save their city...a quest that takes them to the surface world and transforms them into superheroes."
9543,Prince of Persia: The Sands of Time,2010-05-19,2010.0,5.0,7.2376,6.296,7122,"Adventure, Fantasy, Action",en,"A rogue prince reluctantly joins forces with a mysterious princess and together, they race against dark forces to safeguard an ancient dagger capable of releasing the Sands of Time – gift from the gods that can reverse time and allow its possessor to rule the world."
10719,Elf,2003-11-07,2003.0,11.0,7.2359,6.666,4507,"Comedy, Family, Fantasy",en,"When young Buddy falls into Santa's gift sack on Christmas Eve, he's transported back to the North Pole and raised as a toy-making elf by Santa's helpers. But as he grows into adulthood, he can't shake the nagging feeling that he doesn't belong. Buddy vows to visit Manhattan and find his real dad, a workaholic."
11653,The Myth,2005-05-11,2005.0,5.0,7.2195,6.408,415,"Action, Adventure, Comedy, Drama, Fantasy",zh,"When a fellow scientist asks for Jack's help in locating the mausoleum of China's first emperor, the past collides violently with the present as Jack discovers his amazing visions are based in fact."
572154,Rascal Does Not Dream of a Dreaming Girl,2019-06-15,2019.0,6.0,7.2102,8.26,585,"Animation, 10749, Drama, Fantasy",ja,"In Fujisawa, Sakuta Azusagawa is in his second year of high school. Blissful days with his girlfriend and upperclassman, Mai Sakurajima, are interrupted by the appearance of his first crush, Shoko Makinohara."
590223,Love and Monsters,2020-10-16,2020.0,10.0,7.1944,7.27,4411,"Adventure, Comedy, Fantasy, Sci-Fi",en,"Seven years since the Monsterpocalypse began, Joel Dawson has been living underground in order to survive. But after reconnecting over radio with his high school girlfriend Aimee, Joel decides to venture out to reunite with her, despite all the dangerous monsters that stand in his way."
756,Fantasia,1940-11-13,1940.0,11.0,7.1823,7.339,3299,"Animation, Family, Fantasy",en,"Walt Disney's timeless masterpiece is an extravaganza of sight and sound! See the music come to life, hear the pictures burst into song and experience the excitement that is Fantasia over and over again."
8960,Hancock,2008-07-01,2008.0,7.0,7.1675,6.353,10186,"Fantasy, Action",en,"Hancock is a down-and-out superhero who's forced to employ a PR expert to help repair his image when the public grows weary of all the damage he's inflicted during his lifesaving heroics. The agent's idea of imprisoning the antihero to make the world miss him proves successful, but will Hancock stick to his new sense of purpose or slip back into old habits?"
2300,Space Jam,1996-11-15,1996.0,11.0,7.1664,6.808,6372,"Family, Animation, Sci-Fi, Fantasy, Comedy",en,"With their freedom on the line, the Looney Tunes seek the help of NBA superstar Michael Jordan to win a basketball game against a team of moronic aliens."
8204,The Spiderwick Chronicles,2008-02-14,2008.0,2.0,7.1335,6.685,2819,"Family, Adventure, Fantasy, Drama",en,"Upon moving into the run-down Spiderwick Estate with their mother, twin brothers Jared and Simon Grace, along with their sister Mallory, find themselves pulled into an alternate world full of faeries and other creatures."
21835,A Chinese Odyssey Part Two: Cinderella,1995-02-04,1995.0,2.0,7.1238,7.7,258,"Action, Adventure, Fantasy, Comedy, 10749, Drama",cn,"This sequel to ""Pandora's Box"" continues director Jeffrey Lau's adaptation of the Buddhism saga ""Journey to the West"". Stranded five centuries in the past, Joker Monkey King must battle a variety of monsters, seductive women and super-powered villains to save the dying Pak Jing-Jing."
293863,The Age of Adaline,2015-04-16,2015.0,4.0,7.1106,7.466,7062,"10749, Fantasy, Drama",en,"After 29-year-old Adaline recovers from a nearly lethal accident, she inexplicably stops growing older. As the years stretch on and on, Adaline keeps her secret to herself  until she meets a man who changes her life."
1098006,Fountain of Youth,2025-05-19,2025.0,5.0,7.1069,6.254,900,"Adventure, Fantasy, 9648",en,"A treasure-hunting mastermind assembles a team for a life-changing adventure. But to outwit and outrun threats at every turn, he'll need someone even smarter than he is: his estranged sister."
839033,The Lord of the Rings: The War of the Rohirrim,2024-12-05,2024.0,12.0,7.1013,6.544,836,"Animation, Fantasy, Adventure, Action",en,"A sudden attack by Wulf, a clever and traitorous lord of Rohan seeking vengeance for the death of his father, forces Helm Hammerhand, the King of Rohan, and his people to make a daring last stand in the ancient stronghold of the Hornburg."
277217,Descendants,2015-07-31,2015.0,7.0,7.0698,7.153,2493,"Family, Adventure, Fantasy, 10770, 10402",en,"A present-day idyllic kingdom where the benevolent teenage son of King Adam and Queen Belle offers a chance of redemption for the troublemaking offspring of Disney's classic villains: Cruella De Vil (Carlos), Maleficent (Mal), the Evil Queen (Evie) and Jafar (Jay)."
9387,Conan the Barbarian,1982-03-16,1982.0,3.0,7.0684,6.801,2763,"Adventure, Fantasy, Action",en,"A horde of rampaging warriors massacre the parents of young Conan and enslave the young child for years on The Wheel of Pain. As the sole survivor of the childhood massacre, Conan is released from slavery and taught the ancient arts of fighting. Transforming himself into a killing machine, Conan travels into the wilderness to seek vengeance on Thulsa Doom, the man responsible for killing his family. In the wilderness, Conan takes up with the thieves Valeria and Subotai. The group comes upon King Osric, who wants the trio of warriors to help rescue his daughter who has joined Doom in the hills."
9297,Monster House,2006-06-30,2006.0,6.0,7.0633,6.708,4303,"Animation, Comedy, Family, Fantasy",en,"Monsters under the bed are scary enough, but what happens when an entire house is out to get you? Three teens aim to find out when they go up against a decrepit neighboring home and unlock its frightening secrets."
337401,Mulan,2020-09-04,2020.0,9.0,7.0629,6.831,7013,"Adventure, Fantasy, Action",en,"When the Emperor of China issues a decree that one man per family must serve in the Imperial Chinese Army to defend the country from Huns, Hua Mulan, the eldest daughter of an honored warrior, steps in to take the place of her ailing father. She is spirited, determined and quick on her feet. Disguised as a man by the name of Hua Jun, she is tested every step of the way and must harness her innermost strength and embrace her true potential."
2978,Ghostbusters II,1989-06-16,1989.0,6.0,7.0509,6.595,4811,"Comedy, Fantasy",en,The discovery of a massive river of ectoplasm and a resurgence of spectral activity allows the staff of Ghostbusters to revive the business.
71676,Ghost Rider: Spirit of Vengeance,2011-12-10,2011.0,12.0,7.0481,5.011,4034,"Action, Fantasy, 53",en,"When the devil resurfaces with aims to take over the world in human form, Johnny Blaze reluctantly comes out of hiding to transform into the flame-spewing supernatural hero Ghost Rider -- and rescue a 10-year-old boy from an unsavory end."
1203329,The Witcher: Sirens of the Deep,2025-02-10,2025.0,2.0,7.0466,6.814,266,"Animation, Fantasy, Action",en,"When human sailors are attacked by mysterious creatures of the deep, only one person can stop the war between land and sea: the Witcher, Geralt of Rivia."
451048,Jungle Cruise,2021-07-28,2021.0,7.0,7.0425,7.296,6118,"Fantasy, Adventure, Action",en,"Dr. Lily Houghton enlists the aid of wisecracking skipper Frank Wolff to take her down the Amazon in his dilapidated boat. Together, they search for an ancient tree that holds the power to heal – a discovery that will change the future of medicine."
957452,The Crow,2024-08-21,2024.0,8.0,7.0351,5.814,1244,"Action, Fantasy, Horror",en,"Soulmates Eric and Shelly are brutally murdered when the demons of her dark past catch up with them. Given the chance to save his true love by sacrificing himself, Eric sets out to seek merciless revenge on their killers, traversing the worlds of the living and the dead to put the wrong things right."
