id,title,release_date,release_year,release_month,popularity,vote_average,vote_count,genres,original_language,overview
576784,Upon the Magic Roads,2021-02-18,2021.0,2.0,4.5143,6.791,309,"Adventure, Fantasy",ru,"Romantic John the Fool and his friend Foal set out on a series of unpredictable adventures in different magical worlds. The two buddies will have to outsmart an evil tyrant king, catch the firebird, and find John’s true love."
431819,Fireworks,2017-08-18,2017.0,8.0,4.5111,6.6,362,"Animation, 10749, Fantasy, Drama",ja,"Moshimo, Japan. The annual fireworks festival is about to take place and a group of schoolboys, arguing over whether they are round or flat when viewed from different angles, set out to find it out."
11551,Small Soldiers,1998-07-10,1998.0,7.0,4.5046,6.557,2302,"Comedy, Adventure, Fantasy, Sci-Fi, Action",en,"When missile technology is used to enhance toy action figures, the toys soon begin to take their battle programming too seriously."
149509,Horns,2013-09-06,2013.0,9.0,4.5016,6.296,2419,"Drama, Fantasy, 53",en,"In the aftermath of his girlfriend's mysterious death, a young man awakens to strange horns sprouting from his temples."
283984,Fate/stay night: Heaven's Feel I. Presage Flower,2017-10-14,2017.0,10.0,4.4976,7.423,252,"Action, Animation, Drama, Fantasy, 10749",ja,"Ten years after the Fourth Holy Grail War, a devastating clash between Masters and Servants, another war erupts. Shirou Emiya, whose father fought in the first battle, was leading a peaceful life with the warmhearted Sakura Matou. But when hidden forces begin to stir, Shirou resolves to fulfill his father’s dying wish, protect Sakura, and fight for the Holy Grail."
39057,Pokémon: Arceus and the Jewel of Life,2009-07-18,2009.0,7.0,4.4967,7.1,306,"Family, Animation, Adventure, Fantasy",ja,"When the creator of the world, Arceus, comes to pass judgement on humanity for the theft of the legendary Jewel of Life, Ash and his friends are sent back in time to possibly reverse the events that led to Arceus' vendetta."
739547,Thelma the Unicorn,2024-05-17,2024.0,5.0,4.4933,6.909,193,"Animation, Fantasy, Family",en,"Thelma dreams of being a glamorous unicorn. Then in a rare pink and glitter-filled moment of fate, Thelma's wish comes true. She rises to instant international stardom, but at an unexpected cost. After a while, Thelma realizes that she was happier as her ordinary, sparkle-free self. So she ditches her horn, scrubs off her sparkles, and returns home, where her best friend is waiting for her with a hug."
15775,If Only,2004-01-23,2004.0,1.0,4.4903,7.023,643,"Drama, 10749, Fantasy",en,"After his impetuous musician girlfriend, Samantha, dies in an accident shortly after they had a fight (and nearly broke up), Ian Wyndham, a grief-stricken British businessman living in London gets a chance to relive the day all over again, in the hope of changing the events that led up to her getting killed."
682153,Doraemon: Nobita's New Dinosaur,2020-08-07,2020.0,8.0,4.4895,7.4,55,"Animation, Adventure, Family, Fantasy, Sci-Fi, Comedy",ja,Nobita accidentally finds a fossil dinosaur egg mixed with rocks in the dinosaur fossil exhibition site that he had visited before. He returns it to its original state with the 'time blanket'.
475430,Artemis Fowl,2020-05-29,2020.0,5.0,4.4836,5.525,1726,"Adventure, Fantasy, Sci-Fi, Family",en,Artemis Fowl is a 12-year-old genius and descendant of a long line of criminal masterminds. He soon finds himself in an epic battle against a race of powerful underground fairies who may be behind his father's disappearance.
9824,Mystery Men,1999-08-06,1999.0,8.0,4.483,5.84,904,"Adventure, Fantasy, Action, Comedy, Sci-Fi",en,"When Champion City's hero Captain Amazing is kidnapped by the recently paroled supervillain Casanova Frankenstein, a trio of average, everyday superheroes -- Mr. Furious, the Shoveler and the Blue Raja -- assemble a new super team to save him."
15139,The Pagemaster,1994-11-23,1994.0,11.0,4.4757,6.401,775,"Family, Fantasy, Animation",en,"Rich knows a lot about accidents. So much so, he is scared to do anything that might endanger him, like riding his bike, or climbing into his treehouse. While in an old library, he is mystically transported into the unknown world of books, and he has to try and get home again."
347031,Swiss Army Man,2016-06-24,2016.0,6.0,4.4672,6.9,3785,"Comedy, Drama, 10749, Fantasy, Adventure",en,"Alone on a tiny deserted island, Hank has given up all hope of ever making it home again. But one day everything changes when a dead body washes ashore, and he soon realizes it may be his last opportunity to escape certain death. Armed with his new “friend” and an unusual bag of tricks, the duo go on an epic adventure to bring Hank back to the woman of his dreams."
542224,Gretel & Hansel,2020-01-30,2020.0,1.0,4.461,6.018,1552,"Horror, Fantasy, 9648",en,"A long time ago in a distant fairy tale countryside, a young girl leads her little brother into a dark wood in desperate search of food and work, only to stumble upon a nexus of terrifying evil."
11395,The Santa Clause,1994-11-11,1994.0,11.0,4.4605,6.515,2273,"Fantasy, Drama, Comedy, Family",en,"On Christmas Eve, divorced dad Scott Calvin and his son discover Santa Claus has fallen off their roof. When Scott takes the reins of the magical sleigh, he finds he is now the new Santa, and must convince a world of disbelievers, including himself."
976720,Vesper,2022-08-17,2022.0,8.0,4.4601,6.3,688,"Sci-Fi, Drama, Adventure, Fantasy",en,"After the collapse of Earth's ecosystem, Vesper, a 13-year-old girl struggling to survive with her paralyzed Father, meets a mysterious Woman with a secret that forces Vesper to use her wits, strength and bio-hacking abilities to fight for the possibility of a future."
445030,No Game No Life: Zero,2017-07-15,2017.0,7.0,4.4579,7.829,433,"Adventure, Animation, Drama, Fantasy, 10749",ja,"Six thousand years before Sora and Shiro were even a blink in the history of Disboard, war consumed the land, tearing apart the heavens, destroying stars, and even threatening to wipe out the human race. Amid the chaos and destruction, a young man named Riku leads humanity toward the tomorrow his heart believes in. One day, in the ruins of an Elf city, he meets Schwi, a female exiled ""Ex Machina"" android who asks him to teach her what it means to have a human heart."
72358,A Thousand Words,2012-03-07,2012.0,3.0,4.4483,6.099,1390,"Drama, Comedy, Fantasy",en,"Jack McCall is a fast-talking literary agent, who can close any deal, any time, any way. He has set his sights on New Age guru Dr. Sinja for his own selfish purposes. But Dr. Sinja is on to him, and Jack’s life comes unglued after a magical Bodhi tree mysteriously appears in his backyard. With every word Jack speaks, a leaf falls from the tree and he realizes that when the last leaf falls, both he and the tree are toast. Words have never failed Jack McCall, but now he’s got to stop talking and conjure up some outrageous ways to communicate or he’s a goner."
34065,Pokémon: Destiny Deoxys,2004-07-22,2004.0,7.0,4.4474,6.624,286,"Family, Adventure, Animation, Fantasy",ja,"Deoxys, a Pokémon from outer space, terrorizes the high-tech city Ash Ketchum and his friends are visiting."
536869,Cats,2019-12-19,2019.0,12.0,4.4379,4.097,1041,"Fantasy, Comedy, Drama",en,A tribe of cats called the Jellicles must decide yearly which one will ascend to the Heaviside Layer and come back to a new Jellicle life.
8965,Atlantis: Milo's Return,2003-02-25,2003.0,2.0,4.4302,6.334,3893,"Fantasy, Animation, Sci-Fi, Family, Action",en,Milo and Kida reunite with their friends to investigate strange occurances around the world that seem to have links to the secrets of Atlantis.
539517,Constantine: City of Demons - The Movie,2018-10-04,2018.0,10.0,4.4181,7.676,654,"Fantasy, Animation, Horror, Action",en,"A decade after a tragic mistake, family man Chas Chandler and occult detective John Constantine set out to cure his daughter Trish from a mysterious supernatural coma."
33320,Millennium Actress,2002-09-14,2002.0,9.0,4.4168,7.838,1001,"Drama, Animation, 10749, Fantasy",ja,"Documentary filmmaker Genya Tachibana has tracked down the legendary actress Chiyoko Fujiwara, who mysteriously vanished at the height of her career. When he presents her with a key she had lost and thought was gone forever, the filmmaker could not have imagined that it would not only unlock the long-held secrets of Chiyoko’s life... but also his own."
816904,Mummies,2023-01-05,2023.0,1.0,4.4163,6.913,501,"Animation, Adventure, Fantasy, Family",es,"Through a series of unfortunate events, three mummies end up in present-day London and embark on a wacky and hilarious journey in search of an old ring belonging to the Royal Family, stolen by ambitious archaeologist Lord Carnaby."
337703,The Red Turtle,2016-03-27,2016.0,3.0,4.4143,7.445,1359,"Animation, Drama, Fantasy, Family",fr,"The dialogue-less film follows the major life stages of a castaway on a deserted tropical island populated by turtles, crabs and birds."
926899,The House,2022-01-14,2022.0,1.0,4.404,7.018,1125,"Animation, Drama, Comedy, Horror, Fantasy",en,"Across different eras, a poor family, an anxious developer and a fed-up landlady become tied to the same mysterious house in this animated dark comedy."
1024,Heavenly Creatures,1994-09-12,1994.0,9.0,4.4025,6.972,1026,"Drama, Fantasy",en,"Precocious teenager Juliet moves to New Zealand with her family and soon befriends the quiet, brooding Pauline through their shared love of fantasy and literature. This friendship gradually develops into an intense and obsessive bond."
161704,Doraemon: Nobita's Little Star Wars,1985-03-16,1985.0,3.0,4.4009,7.1,53,"Animation, Adventure, Family, Fantasy, Sci-Fi",ja,"As Nobita, Gian, Shizuka, and Suneo are making their own space movie, a fleeing bug-sized alien president makes his way to Earth, and needs the help of the kids and Doraemon to stop an oppressive dictatorship threatening his democracy."
14191,Aquamarine,2006-03-03,2006.0,3.0,4.4001,6.463,1568,"Fantasy, 10749, Family, Comedy",en,"Two teenage girls discover that mermaids really do exist after a violent storm washes one ashore. The mermaid, a sassy creature named Aquamarine, is determined to prove to her father that real love exists, and enlists the girls' help in winning the heart of a handsome lifeguard."
9667,The Jacket,2005-03-04,2005.0,3.0,4.3947,6.867,1669,"Drama, 9648, Sci-Fi, 53, Fantasy",en,"A military veteran goes on a journey into the future, where he can foresee his death and is left with questions that could save his life and those he loves."
549649,Dancing With Ghosts,2018-09-27,2018.0,9.0,4.3903,3.0,1,"Fantasy, Drama, Comedy",ko,"Yoo-jin appears in the dreams of Dong-jae who is a host for lonely women at night. She appears in real life, asking him for help. What she needs is to sleep with him once. Yoo-jin was a virgin ghost and she needed Dong-jae to help her to go back to the after world. However, he doesn't want to sleep with her because she used to be his crush and he'd been waiting to see her in his dreams and in real life. He is afraid sleeping with her will make him lose her. Will he sleep with her or continue to live with her like this?"
297021,"Recently, My Sister Is Unusual",2014-05-17,2014.0,5.0,4.3903,6.868,76,"Comedy, Fantasy, 10749",ja,"Mitsuki and Yuya become stepsister and stepbrother because of their parents' marriage. Mitsuki can't get along with her new family and Yuya doesn't know how to approach his new stepsister. One day, Mitsuki becomes possessed by the spirit of Hiyori.  Hiyori likes Yuya and believes Yuya can help her get to heaven. Hiyori places a leather chastity belt upon on Mitsuki and a plan takes place to help send Hiyori to heaven."
162095,Doraemon: Nobita and the Robot Kingdom,2002-03-09,2002.0,3.0,4.3888,6.6,24,"Animation, Adventure, Fantasy, Sci-Fi, Family",ja,"Nobita, Doraemon, and the rest travel to the far future, on an inhabited planet where humans and robots coexist. The Empress of the Robot Kingdom is plotting to strip the robot inhabitants of their emotions, so it's up to Nobita and his friends to stop the plan, while also helping a robot boy named Poko from getting caught in the middle."
25278,One Piece: The Desert Princess and the Pirates: Adventure in Alabasta,2007-03-03,2007.0,3.0,4.3876,6.9,165,"Action, Adventure, Animation, Comedy, Fantasy",ja,"The Straw Hat Pirates are on a quest to save the desert kingdom of Alabasta. A civil war brews among the sands, one started and stirred by the hand of none other than Crocodile and his corrupted Baroque Works gang. The stakes run ever higher as Princess Vivi's homeland threatens to tear itself apart. More than lives are on the line."
511817,Wendell & Wild,2022-10-21,2022.0,10.0,4.3816,6.6,379,"Animation, Comedy, Fantasy, Adventure, Horror",en,Two scheming demons strike a deal with a punk rock-loving teen so they can leave the Underworld and live out their dreams in the Land of the Living.
123,The Lord of the Rings,1978-11-15,1978.0,11.0,4.3785,6.594,1032,"Adventure, Animation, Fantasy",en,"Young Hobbit Frodo Baggins is thrown into an amazing adventure when he's tasked with destroying the One Ring, created by the dark lord Sauron. Frodo must travel in a small fellowship of nine warriors and accomplices. But it won't be an easy journey for the Fellowship of the Ring, on the ultimate quest to rid Middle-earth of evil."
339967,Colossal,2017-04-06,2017.0,4.0,4.3776,6.275,2255,"Drama, Fantasy, Sci-Fi",en,A woman discovers that severe catastrophic events are somehow connected to the mental breakdown from which she's suffering.
370964,I Am Dragon,2015-12-03,2015.0,12.0,4.3759,7.169,408,"Fantasy, 10749",ru,"In the midst of the wedding princess Miroslava is kidnapped by a dragon and carried away into his castle on the remote island. Mira left everything behind in the past - family, friends and groom. Now the only things she had were a stone cage and a mysterious young man named Arman ... but who is he and what is he doing on that island? Miroslava will know the truth too late: loving a dragon will reveal the bitter truth - love is scary."
421892,Shrek 5,2027-06-30,2027.0,6.0,4.3682,0.0,0,"Animation, Family, Comedy, Fantasy, Adventure",en,The fifth film in the Shrek franchise. Plot TBA.
1039960,Monster High 2,2023-10-05,2023.0,10.0,4.3522,6.817,101,"Fantasy, Sci-Fi, Action, Adventure",en,"As they enter sophomore year at Monster High, Clawdeen Wolf, Draculaura and Frankie Stein face new students, new powers, and an even bigger threat that could not only tear their friendship apart but could change the world forever."
10588,The Cat in the Hat,2003-11-21,2003.0,11.0,4.3519,5.294,1769,"Family, Comedy, Adventure, Fantasy",en,"During a rainy day, and while their mother is out, Conrad and Sally, and their pet fish, are visited by the mischievous Cat in the Hat. Fun soon turns to mayhem, and the siblings must figure out how to rid themselves of the maniacal Cat."
732459,Blade of the 47 Ronin,2022-10-25,2022.0,10.0,4.347,6.397,224,Fantasy,en,A new class of warriors emerges among the Samurai clans to keep a sought-after sword from falling into the wrong hands.
9647,Scrooged,1988-11-22,1988.0,11.0,4.3439,6.784,1683,"Fantasy, Comedy, Drama",en,"Frank Cross is a wildly successful television executive whose cold ambition and curmudgeonly nature has driven away the love of his life. But after firing a staff member on Christmas Eve, Frank is visited by a series of ghosts who give him a chance to re-evaluate his actions and right the wrongs of his past."
668461,Slumberland,2022-11-18,2022.0,11.0,4.3373,7.279,927,"Family, Fantasy, Comedy",en,"A young girl discovers a secret map to the dreamworld of Slumberland, and with the help of an eccentric outlaw, she traverses dreams and flees nightmares, with the hope that she will be able to see her late father again."
307130,Junior,2011-05-16,2011.0,5.0,4.3373,6.5,72,"Horror, Fantasy",fr,A pimple-faced 13-year-old tomboy starts morphing in bizarre ways after catching stomach flu.
831405,Injustice,2021-10-09,2021.0,10.0,4.328,7.336,836,"Animation, Sci-Fi, Fantasy, Action",en,"When Lois Lane is killed, an unhinged Superman decides to take control of the Earth. Determined to stop him, Batman creates a team of freedom-fighting heroes. But when superheroes go to war, can the world survive?"
103332,Ruby Sparks,2012-07-25,2012.0,7.0,4.3268,7.119,1758,"Comedy, 10749, Fantasy, Drama",en,"Calvin is a young novelist who achieved phenomenal success early in his career but is now struggling with his writing – as well as his romantic life. Finally, he makes a breakthrough and creates a character named Ruby who inspires him. When Calvin finds Ruby, in the flesh, sitting on his couch about a week later, he is completely flabbergasted that his words have turned into a living, breathing person."
11639,The Dark Crystal,1982-12-17,1982.0,12.0,4.3183,7.135,1244,"Adventure, Family, Fantasy",en,"On another planet in the distant past, a Gelfling embarks on a quest to find the missing shard of a magical crystal and restore order to his world, before the grotesque race of Skeksis find and use the crystal for evil."
259910,Marvel Studios: Assembling a Universe,2014-03-18,2014.0,3.0,4.3118,6.925,167,"99, 10770, Fantasy",en,"A look at the story behind Marvel Studios and the Marvel Cinematic Universe, featuring interviews and behind-the-scenes footage from all of the Marvel films, the Marvel One-Shots and ""Marvel's Agents of S.H.I.E.L.D.""!"
667520,A Whisker Away,2020-06-18,2020.0,6.0,4.3105,7.877,1480,"Animation, Drama, 10749, Fantasy",ja,"A peculiar girl transforms into a cat to catch her crush's attention. But before she realizes it, the line between human and animal starts to blur."
201223,Blue Exorcist: The Movie,2012-12-28,2012.0,12.0,4.3102,7.2,173,"Animation, Fantasy, 9648, Horror, Action",ja,"The atmosphere in True Cross Academy is lively and boisterous in the days leading up to the grand festival held once every 11 years. During this time, Okumura Rin is entrusted with the responsibility of suppressing the berserk Phantom Train. In the midst of his mission, he meets a devil whose appearance is that of a young boy."
1241894,Woodwalkers,2024-10-17,2024.0,10.0,4.308,6.3,71,"Fantasy, Family",de,"Humans who can shapeshift into animals struggle to integrate with others without revealing their special abilities. As a group, they strive to inform and institute change in the perspective of deforestation and the importance of natural habitats. However, when that cannot happen, they're forced to take matters into their own hands."
11319,The Rescuers,1977-06-22,1977.0,6.0,4.3038,6.789,2670,"Fantasy, Family, Animation, Adventure",en,Two agents of the mouse-run International Rescue Aid Society search for a little orphan girl kidnapped by sinister treasure hunters.
7985,Penelope,2007-11-17,2007.0,11.0,4.3017,6.742,1465,"Fantasy, Comedy, 10749",en,"Forlorn heiress Penelope Wilhern is cursed, and the only way out is to fall in love with someone of suitable stock. But how can she find her soulmate when she's sequestered inside her family's estate with only her parents to keep her company? This untraditional fairy tale is about a girl who bucks convention to create her own happy ending."
2134,The Time Machine,1960-05-25,1960.0,5.0,4.301,7.349,901,"53, Adventure, Fantasy, Sci-Fi, 10749",en,A Victorian Englishman travels to the far future and finds that humanity has divided into two hostile species.
11236,The Secret Garden,1993-08-13,1993.0,8.0,4.2991,7.4,970,"Drama, Family, Fantasy",en,"A young British girl born and reared in India loses her neglectful parents in an earthquake. She is returned to England to live at her uncle's castle. Her uncle is very distant due to the loss of his wife ten years before. Neglected once again, she begins exploring the estate and discovers a garden that has been locked and forgotten. Aided by one of the servants' boys, she begins restoring the garden, and eventually discovers some other secrets of the manor."
1235431,Oshi no Ko -The Final Act-,2024-12-20,2024.0,12.0,4.2963,6.4,10,"Drama, 10402, Fantasy",ja,"Goro is a gynecologist and idol fan who’s in shock after his favorite star, Ai, announces an impromptu hiatus. Little does Goro realize that he’s about to forge a bond with her that defies all common sense! Lies are an idol’s weapon!"
1223178,Umamusume: Pretty Derby - Beginning of a New Era,2024-05-24,2024.0,5.0,4.2956,7.9,17,"Animation, Drama, Comedy, Fantasy",ja,"Jungle Pocket, an Umamusume who has been racing tirelessly in pursuit of becoming the greatest, is ready to take on the once-in-a-lifetime Classic Triple Crown series. However, standing in her way are rivals from the same generation, whose talent may even surpass her own."
212162,Puella Magi Madoka Magica the Movie Part III: Rebellion,2013-10-26,2013.0,10.0,4.2919,7.7,200,"9648, Animation, Fantasy",ja,"Following Madoka's rewriting of the universe, sacrificing herself and her happy normal days to save all magical girls from the cruel fate that awaited them by wiping witches out of existence, the despair still manifest into creatures known as nightmares. Magical girl Homura Akemi continues to fight alone in the hope that she will be able to see Madoka smile again."
991,The Man Who Fell to Earth,1976-03-18,1976.0,3.0,4.2901,6.455,587,"Sci-Fi, Drama, Fantasy",en,"Thomas Jerome Newton is an alien who has come to Earth in search of water to save his home planet. Aided by lawyer Oliver Farnsworth, Thomas uses his knowledge of advanced technology to create profitable inventions. While developing a method to transport water, Thomas meets Mary-Lou, a quiet hotel clerk, and begins to fall in love with her. Just as he is ready to leave Earth, Thomas is intercepted by the U.S. government, and his entire plan is threatened."
560044,The Willoughbys,2020-04-22,2020.0,4.0,4.2891,7.043,963,"Animation, Comedy, Family, Fantasy",en,"When the four Willoughby children are abandoned by their selfish parents, they must learn how to adapt their Old-Fashioned values to the contemporary world in order to create something new: The Modern Family."
11934,The Hudsucker Proxy,1994-03-11,1994.0,3.0,4.2878,7.068,1176,"Comedy, Drama, Fantasy",en,A naive business graduate is installed as president of a manufacturing company as part of a stock scam.
3115,"Ebirah, Horror of the Deep",1966-12-17,1966.0,12.0,4.2827,6.272,215,"Sci-Fi, Action, Fantasy",ja,"Searching for his brother, Ryota stows away on a boat belonging to a criminal alongside two other teenagers. The group shipwrecks on Letchi island and discover the Infant Island natives have been enslaved by a terrorist organization controlling a crustacean monster. Finding a sleeping Godzilla, they decide to awaken him to defeat the terrorists and liberate the natives."
39323,Dragon Ball Z: Bardock - The Father of Goku,1990-10-17,1990.0,10.0,4.2821,7.567,761,"Animation, Action, Sci-Fi, Drama, Fantasy",ja,"Bardock, Son Goku's father, is a low-ranking Saiyan soldier who was given the power to see into the future by the last remaining alien on a planet he just destroyed. He witnesses the destruction of his race and must now do his best to stop Frieza's impending massacre."
424781,Sorry to Bother You,2018-07-06,2018.0,7.0,4.2817,6.775,1735,"Fantasy, Sci-Fi, Comedy",en,"In an alternate present-day version of Oakland, black telemarketer Cassius Green discovers a magical key to professional success – which propels him into a macabre universe."
15283,Pom Poko,1994-07-16,1994.0,7.0,4.2817,7.2,1190,"Adventure, Animation, Fantasy",ja,"The Raccoons of the Tama Hills are being forced from their homes by the rapid development of houses and shopping malls. As it becomes harder to find food and shelter, they decide to band together and fight back. The Raccoons practice and perfect the ancient art of transformation until they are even able to appear as humans in hilarious circumstances."
147576,Doraemon: Nobita and the Castle of the Undersea Devil,1983-03-12,1983.0,3.0,4.2807,7.057,35,"Animation, Adventure, Family, Fantasy, Sci-Fi",ja,"Nobita and his friends under the waters of the Pacific Ocean. Gian and Suneo take Doraemon's underwater vehicle and travel through the Atlantic Ocean, trying to find a treasure ship."
16774,Hellboy Animated: Sword of Storms,2006-10-28,2006.0,10.0,4.2797,6.309,152,"Sci-Fi, Animation, Fantasy, Action, Horror, Adventure, 53, 10770",en,"A folklore professor becomes unwittingly possessed by the ancient Japanese demons of Thunder and Lightning. But when The Bureau of Paranormal Research & Defense dispatches a team of agents to investigate, a cursed samurai sword sends Hellboy to a supernatural dimension of ghosts, monsters, and feudal mayhem. Now while pyrokinetic Liz Sherman and fishboy Abe Sapien battle one very pissed-off dragon, a lost and cranky Hellboy must find his way home."
265712,Stand by Me Doraemon,2014-08-08,2014.0,8.0,4.2739,7.385,580,"Animation, Adventure, Sci-Fi, Drama, Family, Fantasy",ja,Sewashi and Doraemon find themselves way back in time and meet Nobita. It is up to Doraemon to take care of Nobita or else he will not return to the present.
285213,The Pirates,2014-08-06,2014.0,8.0,4.2732,6.998,233,"Action, Adventure, Comedy, Fantasy",ko,"At the cusp of the founding of Joseon Dynasty, an envoy from China is delivering Emperor’s Ming’s Royal Seal. But nature in the form of a giant whale intervenes and swallows the royal seal.  When a generous reward is offered to whomever can retrieve the royal seal from the belly of the whale, the race is on. A group of mountain bandits led by Jang Sa Jung and a group of pirates led by Yeo Wol  go after the lost treasure, but who will get to to it first?"
