id,title,release_date,release_year,release_month,days_until_release,popularity,vote_average,vote_count,genres,original_language,overview
1654313,Unanswered//butterfly,2026-07-09,2026,7,77,0.4124,0.0,0,"Action, Sci-Fi, Animation, Fantasy",ja,"The world’s first full-dive VRMMO, Sword Art Online—known as SAO. What was meant to be a dream come true has instead transformed into a deadly game where dying in the virtual world means dying in reality. Emirun and Rex, who once knew each other in the real world, reunite by chance within SAO. They join a scouting party to learn how to survive in this unforgiving world. One day, however, they encounter a mysterious PK known only as the Black Swordsman. When Emirun rushes to the scene, she finds Rex collapsed in despair, and the Black Swordsman standing over him. The one who wiped out their entire scouting party... was the Black Swordsman! Determined to avenge their fallen comrades, Emirun and Rex seek out the legendary prodigy swordswoman Asuna, and begin intense training under her guidance. In a death game where even players turn against one another, what new beginning will these two reach at the end of their struggle…?"
1658666,大圣崛起,2026-07-10,2026,7,78,1.2595,0.0,0,"Animation, Fantasy, Adventure",zh,
1229939,Vishwambhara,2026-07-10,2026,7,78,0.4352,0.0,0,Fantasy,te,
1368337,The Odyssey,2026-07-15,2026,7,83,11.9771,0.0,0,"Adventure, Drama, Fantasy",en,"Odysseus, the legendary Greek king of Ithaca, embarks on a long and perilous journey home following the Trojan War, chronicling his encounters with mythical beings such as the Cyclops Polyphemus, the Sirens, and the witch-goddess Circe, while attempting to reunite with his wife, Penelope."
1318621,Descendants: Wicked Wonderland,2026-07-16,2026,7,84,1.7872,0.0,0,"Fantasy, Family, 10770, 10402",en,"Now that the Queen of Hearts is nice and Cinderella is safe, things seem perfect for Red and Chloe… But little do they know that changing the past created a new villain - Maddox Hatter. When Maddox captures the Queen of Hearts, Red and Chloe must work with Red’s new sister Pink, Luisa Madrigal’s son Luis and Maddox’s son Max to save her and Wonderland."
1151265,La Fille dans les nuages,2026-07-22,2026,7,90,0.5019,0.0,0,"Animation, Adventure, Fantasy",fr,"The adventures of a young girl named Providence, who is entrusted with a magic quill that makes everything she writes come true. Faced with this incredible power, she has to choose between living her dreams and saving the world."
1617335,Kids' Festival! All the Heroes of Justice Appear,2026-07-31,2026,7,99,0.0404,0.0,0,"99, Action, Adventure, Sci-Fi, Fantasy",ja,Kids' Festival! All the Heroes of Justice Appear was a televised celebration of tokusatsu heroes in 1976.
1365362,"Kyma, l'onde mystérieuse",2026-08-05,2026,8,104,0.407,0.0,0,"Fantasy, Adventure",fr,
1135463,Viana – The Legend of the Golden Hearts,2026-08-06,2026,8,105,0.8046,0.0,0,"Animation, Adventure, 10749, Fantasy, 10402",pt,"In the north of medieval Portugal, the beautiful Ana falls in love with Thomas, a poor artisan. Her father immediately forbids their union, demanding that his daughter’s suitors produce a jewel as proof of their nobility. But the young couple refuse to give up. With the help of their faithful companions, the generosity of the townswomen and the talent of a mysterious jewellery maker, Ana and Thomas will face many challenges out of love, including the powerful and evil Duke of Aragon."
1565925,Cakey Heaven,2026-08-15,2026,8,114,0.1802,0.0,0,"Adventure, Animation, Fantasy",en,"On the morning of her childhood dog’s 13th birthday, Florrie is hard at work in the kitchen, preparing the perfect surprise for her senior terrier, Coco Merrytail - one final, wordless celebration of a bond that’s nearing its soft, inevitable fade."
1661276,Shiranuhi,2026-08-21,2026,8,120,0.2774,0.0,0,"Animation, Fantasy, Drama",ja,"In the summer of 1996, 10-year-old Minato is neglected by his alcoholic father and keeps to himself at home in a town by the sea. His only source of solace is Ben-chan, a girl goddess that appears on Benten Island. As Minato faces a new life in an orphanage and a painful parting from Ben-chan, he makes a wish to Shiranui for her. However, growing hatred toward his father gradually turns the wish into a malicious ""curse"" against him…"
1627984,Kristofers un divu pasauļu atslēga,2026-08-21,2026,8,120,0.0168,0.0,0,"Adventure, Fantasy, Family",lv,
1620243,My Armor,2026-08-21,2026,8,120,0.0071,0.0,0,"Drama, Fantasy, 9648",en,"A story of April, whose inability to express her grief to her mother leads to a surreal confrontation with a Knight."
1533249,Soul Trader,2026-08-21,2026,8,120,0.7379,0.0,0,"Comedy, Fantasy, Horror, Drama",en,A despondent soul arrives in a strange place where he must confront his (mostly) inner demons.
